{
  "acceptanceCriteria": [
    "固定 0.5、1.0、1.5、2.0、3.0 m 以及 -30、-15、0、+15、+30° 各连续运行至少 60 秒并保存原始与滤波后轨迹",
    "静止距离滤波后滚动 P95 波动不超过 0.10 m，单帧超过 0.20 m 的异常不会直接改变开锁/迎宾状态",
    "从 3 m 匀速接近并离开时，实时距离额外延迟不超过 500 ms，1 m/2 m 状态只按既定滞回和连续三帧确认变化",
    "第二路低 SNR、高 MAD、丢帧或 NLOS 时自动降级为仅距离有效；恢复后至少连续三帧稳定才重新启用角度",
    "网页回放、实时串口和 MSPM0 使用同一组滤波参数与黄金测试向量，距离差不超过 2 mm、角度差不超过 0.1°"
  ],
  "blockingIssueIds": [],
  "completedAcceptanceCriteria": [],
  "createdAt": "2026-07-30T22:06:04+00:00",
  "dependencies": [
    "T-20260730-11Y3",
    "T-20260730-75QP"
  ],
  "description": "在距离和角度标定数据齐全后，专门解决当前静态测量值可接受但实时显示不稳定的问题。分别验证 Hampel、中值、质量权重、限速器和 Kalman 参数，不用增加过度延迟来掩盖跳变；距离与角度分别维护有效状态，角度失败不得拖累距离输出。",
  "id": "T-20260730-CA0K",
  "module": "C题UWB实时定位",
  "owner": "37chengshan",
  "participants": [],
  "priority": "high",
  "recordType": "task",
  "relatedCommits": [],
  "schemaVersion": 1,
  "status": "todo",
  "title": "整定 UWB 实时滤波、坏链路降级与区域防抖",
  "updatedAt": "2026-07-30T22:06:04+00:00"
}
