{
  "acceptanceCriteria": [
    "所有角度点用激光/卷尺核对 x、y 坐标并写入结构化真值，正前方为 0°、左负右正，禁止仅靠 d1/d2 或手写标签推断角度",
    "1.0 m 与 2.0 m 的 13 个角度各至少两次独立采集，每路至少 100 组同步有效数据并记录 SNR、MAD、丢帧和 NLOS 标记",
    "使用按采集批次分组的独立验证，左右方向符号正确率为 100%，角度 P95 误差不超过 8°、最大误差不超过 10°",
    "输出两基站 250 mm 基线的可观测性报告；若差分距离信号小于噪声或指标失败，明确判定两基站角度不可用并给出第三基站坐标方案",
    "角度质量不足、任一路异常或超出已标定角度范围时，实时界面显示角度无效，固件不得用该角度参与开锁"
  ],
  "blockingIssueIds": [],
  "completedAcceptanceCriteria": [],
  "createdAt": "2026-07-30T22:05:42+00:00",
  "dependencies": [
    "T-20260729-6H2Q",
    "T-20260730-11Y3"
  ],
  "description": "现有 1.0 m 与 2.0 m 多角度数据已证明 250 mm 两基站角度不具备比赛所需精度：独立评估最大误差约 45.3°、P95 约 25.3°。两基站角度继续只用于显示并在不可信时保持上一值，禁止参与开锁。本任务转入第三基站三角布置，按实测坐标重新采集 -45、-30、-20、-15、-10、-5、0、+5、+10、+15、+20、+30、+45°，每点至少两次独立复测。",
  "id": "T-20260730-75QP",
  "module": "C题UWB角度定位",
  "owner": "37chengshan",
  "participants": [],
  "priority": "critical",
  "recordType": "task",
  "relatedCommits": [
    "608f631",
    "b2b5c9c",
    "0c7ab8e"
  ],
  "schemaVersion": 1,
  "status": "doing",
  "title": "完成 UWB 多角度标定并验证两基站角度可观测性",
  "updatedAt": "2026-07-31T11:13:53+00:00"
}
