{
  "acceptanceCriteria": [
    "中轴补采 0.90、0.95、1.00、1.05、1.10、1.80、1.90、1.95、2.00、2.05、2.10、2.20 m，每点至少两次独立摆放和 45 秒采集",
    "在 1.50 m 的 -15°、0°、+15°各补采两次，并与最相近的 1.8～2.0 m 原始双路读数做可分辨性报告",
    "每次采集丢弃前 2 秒，每路保留至少 100 组同步数据，输出中位数、MAD、P05/P95、SNR 和超过 0.2 m 的跳变次数",
    "按采集会话分组交叉验证，1 m 和 2 m 边界距离 P95 误差不超过 0.15 m、最大误差不超过 0.20 m",
    "使用 500 ms 输出和三次突变确认回放所有补测会话，1 m/2 m 状态不得因单次异常来回切换"
  ],
  "blockingIssueIds": [],
  "completedAcceptanceCriteria": [
    "现有 66 个训练点按同一物理距离和角度整组留出完成交叉验证：1 m 附近 P95 约 0.135 m、最大误差 0.200 m；2 m 附近 P95 和最大误差约 0.142 m；1 m/2 m 边界跨错数为 0"
  ],
  "createdAt": "2026-07-31T11:13:53+00:00",
  "dependencies": [
    "T-20260730-11Y3"
  ],
  "description": "现有 68 点运行模型在 1 m 区域表现良好，但部分 2 m ±20°测点与两个 1.5 m 补测点的双路读数高度重叠。新增 SNR、MAD 和分位数未改善独立交叉验证，因此必须补采边界与重叠区，而不是继续增加模型复杂度。",
  "id": "T-20260731-2MBD",
  "module": "C题UWB距离标定",
  "owner": "37chengshan",
  "participants": [],
  "priority": "critical",
  "recordType": "task",
  "relatedCommits": [
    "608f631",
    "b2b5c9c",
    "b64a441"
  ],
  "schemaVersion": 1,
  "status": "doing",
  "title": "补采 UWB 1 m/2 m 边界与 1.5/2 m 重叠区",
  "updatedAt": "2026-07-31T19:54:29+08:00"
}
