{
  "acceptanceCriteria": [
    "UWB、电池、MSPM0 核心板与紫色底板、1.77 英寸 ST7735S 显示模块、拨码、接口和紧固件的长宽高、孔距与突出高度均有实测记录",
    "参数化源文件可导出 STL 或 3MF，钥匙成品不超过 120×80×40 mm，门锁全部结构不超过直径 600 mm、高 300 mm 包络",
    "三枚 UWB 卡匣可快拆、天线区域无遮挡、参考高度一致且装配后坐标可测；最终朝向由测试决定",
    "背面显示、拨码和调试口可操作，FRONT、BACK、中心 O、圆柱边界零点与 KEY REF 标记明确",
    "完成公差试片、首版打印、装配验证和修版记录，并使用装配后实测的 A1/A2/A3 天线坐标"
  ],
  "blockingIssueIds": [
    "I-20260729-152X"
  ],
  "completedAcceptanceCriteria": [
    "参数化源文件可导出 STL 或 3MF，钥匙成品不超过 120×80×40 mm，门锁全部结构不超过直径 600 mm、高 300 mm 包络"
  ],
  "createdAt": "2026-07-29T15:19:43+08:00",
  "dependencies": [
    "T-20260729-KK97",
    "T-20260729-6H2Q"
  ],
  "description": "已完成 v0.4 可拆钥匙控制面板软件交付链：数字钥匙包含真实贯通的启动按键孔、状态 LED 孔和拨动槽，以及捕获式按键帽、拨动滑块、候选 50×20×1.6 mm 控制板导轨；门锁为 Ø276×100 mm 一体底壳/上盖、三 UWB 快拆卡匣、84×64 mm 背面板、拨码固定笼和顶盖加强筋。当前 13 种 STL、16 个标准实例，24/24 CAD 回归和 13/13 STL 重载检查通过。除原三盘方案外，已为 13 种部件分别生成居中 G-code，共 22 个实例：按钮帽/拨动滑块各 3 个，钥匙电池卡扣/拨码固定笼各 2 个，UWB 卡匣 3 个、门锁电池卡扣 2 个，其余各 1 个；13/13 G-code 温度、边界、对象数量和重叠校验通过。喷嘴等待/首层/常规为 220/255/250 ℃，热床首层/常规为 90/85 ℃。包含 0.25/0.35/0.45/0.55 mm 四档的公差试片已实物打印，用户确认打印效果非常完美；仍需确认四档中最佳配合间隙，并实测控制板/开关、UWB、PCB、显示器和线束接口，完成整机装配循环、身份 ID 操作和天线验证。",
  "id": "T-20260729-E7RP",
  "module": "C题3D结构",
  "owner": "37chengshan",
  "participants": [],
  "priority": "high",
  "recordType": "task",
  "relatedCommits": [],
  "schemaVersion": 1,
  "status": "doing",
  "title": "测量并打印 C 题数字钥匙与门锁定位结构首版",
  "updatedAt": "2026-07-30T15:41:30+08:00"
}
