{
  "recordType": "task",
  "schemaVersion": 1,
  "id": "T-20260728-A3F2",
  "title": "检查小车五路电源",
  "module": "小车主板",
  "status": "todo",
  "priority": "high",
  "participants": [],
  "dependencies": [],
  "blockingIssueIds": [],
  "relatedCommits": [],
  "description": "",
  "acceptanceCriteria": [],
  "completedAcceptanceCriteria": [],
  "createdAt": "2026-07-28T20:00:00+08:00",
  "updatedAt": "2026-07-28T20:00:00+08:00"
}
