{
  "acceptanceCriteria": [
    "2～4 路 UART 实例、引脚复用、电平、115200/921600 8N1 可行性和调试接口冲突已按实际板卡核对，SysConfig 无未解释警告",
    "解析器保存每路完整地址、低4位 keyId、距离、SNR与时间戳；按 keyId 和时间窗融合，完整地址仅用于追溯而不错误要求各基站相同",
    "定位输出 x、y、比赛径向距离、方位角及各自有效标志，包含多路求解、两路降级、一路仅保留距离/闭锁策略和 NLOS 剔除",
    "距离不稳定时使用质量门控、滞回和连续三帧确认；角度未通过独立验证时强制 angle_valid=false 且不参与开锁",
    "四位 ID 输入支持临时四按键翻转和最终拨码直读，显示、迎宾声光和红绿锁态 LED 状态机可复现验证",
    "CCS Debug 全量构建为 0 错误；构建结果与目标板串口、显示、定位和状态机实测证据分别记录"
  ],
  "blockingIssueIds": [],
  "completedAcceptanceCriteria": [],
  "createdAt": "2026-07-29T15:19:40+08:00",
  "dependencies": [
    "T-20260729-KK97",
    "T-20260729-6H2Q"
  ],
  "description": "以 .syscfg 为引脚、外设、时钟和中断配置源；先核对 MSPM0G3507 实际 UART 资源、电平和特殊引脚，再实现 2～4 路完整地址/keyId/时间戳解析、定位、4 bit ID 验证、区域状态机及显示。2026-07-30 当前两路距离模型在训练点误差已达标但实时仍有波动，角度实测完全不可用；在 T-20260730-11Y3、T-20260730-75QP、T-20260730-CA0K 和 T-20260730-B5J4 通过前，固件只能把角度标记为无效，不得用于开锁。暂无拨码开关时继续以四个低有效按键翻转 bit3～bit0。",
  "id": "T-20260729-4GQN",
  "module": "C题MSPM0固件",
  "owner": "37chengshan",
  "participants": [],
  "priority": "critical",
  "recordType": "task",
  "relatedCommits": [],
  "schemaVersion": 1,
  "status": "doing",
  "title": "实现 MSPM0 三路 UWB 接收、定位与门锁状态机",
  "updatedAt": "2026-07-30T22:06:49+00:00"
}
