{
  "acceptanceCriteria": [
    "4 个设备的 EWM/EWT 板型、外廓、孔位、天线参考点、供电范围和 UART 电平均有实物记录",
    "实机确认 ROLE、SRCADDR、DSTADDR、RESPONDER_NUM 的准确指令拼写、参数掉电保持和上电自动测距行为",
    "一主一从、一主二从、一主三从均保存连续 UART 原始日志；各基站完整地址、低4位钥匙ID、距离、SNR和时间戳均可追溯",
    "完成 0.5～3.0 m 扩展距离、0°与多角度分层标定；分别报告静态误差、实时抖动、丢帧和异常值，角度未达标时明确标记不可用",
    "距离和角度必须使用独立验证点验收，禁止仅用训练点误差宣称完成"
  ],
  "blockingIssueIds": [],
  "completedAcceptanceCriteria": [],
  "createdAt": "2026-07-29T15:19:37+08:00",
  "dependencies": [
    "T-20260729-KK97"
  ],
  "description": "以厂商资料支持的一主三从 TWR 为目标拓扑，继续完成设备与多从机链路验证。2026-07-30 已取得两基站最终实测集：18 组、13,000 余帧，当前地址分别为 0100/0200，可按低 4 位 keyId=0 与 120 ms 时间窗同步。0.5～1.5 m 标定点距离最大误差约 0.112 m，测量误差可接受但实时输出仍有明显波动；现有角度虽然能显示，但与真实方向不符，判定为不可用，禁止作为开锁依据。后续按 T-20260730-11Y3 扩展距离、T-20260730-75QP 重做角度、T-20260730-CA0K 整定稳定性、T-20260730-B5J4 独立验收。",
  "id": "T-20260729-6H2Q",
  "module": "C题UWB链路",
  "owner": "37chengshan",
  "participants": [],
  "priority": "critical",
  "recordType": "task",
  "relatedCommits": [],
  "schemaVersion": 1,
  "status": "doing",
  "title": "完成 EWM/EWT550 到货鉴定与一主三从测距验证",
  "updatedAt": "2026-07-30T22:07:15+00:00"
}
