{
  "acceptanceCriteria": [
    "独立重采至少 35 个验证点，覆盖 0.5～3.0 m、左右角度、1 m/2 m 边界以及训练网格之间的位置，验证数据不参与重新训练",
    "径向距离最大误差不超过 0.20 m、P95 不超过 0.15 m；角度仅在可用方案下验收，P95 不超过 8°、最大不超过 10°",
    "覆盖丢帧、地址混杂、低 SNR、单基站 NLOS、镜像位置、模型 CRC 损坏和边界抖动，任一不安全情况立即禁止开锁",
    "导出模型通过 CRC、版本、Flash/SRAM 和单次定位时间检查，并用同一黄金向量验证电脑与 C 固件结果",
    "完成目标板构建、烧录和实机连续运行记录；未连接硬件时只能写构建通过，不能写上板通过"
  ],
  "blockingIssueIds": [],
  "completedAcceptanceCriteria": [],
  "createdAt": "2026-07-30T22:06:26+00:00",
  "dependencies": [
    "T-20260730-11Y3",
    "T-20260730-75QP",
    "T-20260730-CA0K",
    "T-20260731-2MBD",
    "T-20260731-A3VW",
    "T-20260729-4GQN"
  ],
  "description": "距离扩展、第三基站角度和实时稳定性任务通过后，使用未参与训练的新摆放位置做最终验收，再导出并烧录 MSPM0 模型。当前四层 HEX 已构建通过但尚未上板；两基站角度已经判定不满足比赛精度，最终角度验收必须使用第三基站方案，不能把训练点拟合结果当作比赛验收。",
  "id": "T-20260730-B5J4",
  "module": "C题UWB系统验收",
  "owner": "37chengshan",
  "participants": [],
  "priority": "critical",
  "recordType": "task",
  "relatedCommits": [
    "998af30",
    "0c7ab8e",
    "b64a441"
  ],
  "schemaVersion": 1,
  "status": "todo",
  "title": "独立验证 UWB 模型并冻结 MSPM0 比赛版本",
  "updatedAt": "2026-07-31T11:13:53+00:00"
}
