{
  "acceptanceCriteria": [
    "第三基站与现有两基站形成非共线三角形，记录实测天线中心坐标；建议初始坐标 A3=(0,-260) mm，垂直基线偏移不得小于 250 mm",
    "为第三基站分配独立 UART，不与一、二号基站共用接收线；完成波特率、地址、供电、共地和连续 10 分钟收包验证",
    "在 1.0 m 和 2.0 m 采集 -45、-30、-20、-15、-10、-5、0、+5、+10、+15、+20、+30、+45°，每点至少两次独立 45 秒采集",
    "按采集会话分组独立验证，左右符号正确率 100%，角度 P95 误差不超过 8°、最大误差不超过 10°",
    "电脑与 MSPM0 使用相同坐标、补偿表和黄金向量，距离差不超过 2 mm、角度差不超过 0.1°；达标后角度才允许参与区域判定"
  ],
  "blockingIssueIds": [],
  "completedAcceptanceCriteria": [],
  "createdAt": "2026-07-31T11:13:53+00:00",
  "dependencies": [
    "T-20260730-75QP",
    "T-20260729-6H2Q"
  ],
  "description": "250 mm 两基站角度独立评估最大误差约 45.3°、P95 约 25.3°，无法通过继续查表满足比赛指标。本任务增加第三基站，使用非共线三角布局和三边测距完成正式二维定位、角度标定和 MSPM0 落地。第四基站后续可按同一接口增加，用于单基站 NLOS 剔除。",
  "id": "T-20260731-A3VW",
  "module": "C题UWB角度定位",
  "owner": "37chengshan",
  "participants": [],
  "priority": "critical",
  "recordType": "task",
  "relatedCommits": [
    "608f631",
    "b2b5c9c",
    "0c7ab8e"
  ],
  "schemaVersion": 1,
  "status": "todo",
  "title": "增加第三基站并完成可信角度标定",
  "updatedAt": "2026-07-31T11:13:53+00:00"
}
