{
  "acceptanceCriteria": [
    "11 个中轴距离全部使用结构化 distanceM/angleDeg/pointId 元数据采集，每点至少两次独立复测，每路至少 100 组同步有效数据",
    "每点输出两路中位数、MAD、P95 范围、SNR、丢帧率和大于 0.2 m 跳变次数，不稳定帧有明确降权或剔除原因",
    "训练与验证按独立采集分组，0.5～3.0 m 独立验证距离 P95 误差不超过 0.15 m、最大误差不超过 0.20 m",
    "0.5、1.0、1.5、2.0、3.0 m 各进行至少 30 秒静止实时显示，滤波后滚动 P95 波动不超过 0.10 m且不持续出现超过 0.20 m跳变",
    "0.95/1.00/1.05 m 与 1.95/2.00/2.05 m 边界点通过三帧确认和滞回验证，状态不反复闪烁"
  ],
  "blockingIssueIds": [],
  "completedAcceptanceCriteria": [],
  "createdAt": "2026-07-30T22:05:17+00:00",
  "dependencies": [
    "T-20260729-6H2Q"
  ],
  "description": "使用当前两基站 250 mm 间距，按中轴 0° 采集 0.5、0.8、0.95、1.00、1.05、1.5、1.95、2.00、2.05、2.5、3.0 m。每点至少两次独立摆放和采集，不能把同一次长采集切片冒充复测。每次丢弃前 2 秒，保存完整原始帧、基站地址、keyId、SNR、时间戳和真实位置元数据。重点解决当前距离误差可接受但实时显示波动的问题。",
  "id": "T-20260730-11Y3",
  "module": "C题UWB标定",
  "owner": "37chengshan",
  "participants": [],
  "priority": "critical",
  "recordType": "task",
  "relatedCommits": [],
  "schemaVersion": 1,
  "status": "todo",
  "title": "扩展 UWB 距离标定到 0.5～3.0 m 并加密 1 m/2 m 边界",
  "updatedAt": "2026-07-30T22:05:17+00:00"
}
